{"artifact_status":"test-only","keys":[{"algorithm":"ed25519-rfc8032","key_id":"sha256:06e3fd8fda29bb60ab59557de61edb0aecdb231134be30e75b455f8e1b792fa9","limitations":["Synthetic fixture key; not trusted for production use."],"public_key":"MCowBQYDK2VwAyEA11qYAYKxCrfVS/7TyWQHOg7hcvPapiMlrwIaaPcHURo=","public_key_digest":"sha256:06e3fd8fda29bb60ab59557de61edb0aecdb231134be30e75b455f8e1b792fa9","public_key_format":"spki-der-base64","status":"active","usage":"release-signing","valid_from":"2026-01-01T00:00:00Z","valid_until":"2028-01-01T00:00:00Z"},{"algorithm":"ed25519-rfc8032","key_id":"sha256:deb2ded39dc26fce0e6085b6fc34bf6b5941913bbfe2ea614113cff9e004c170","limitations":["Synthetic fixture key; not trusted for production use."],"public_key":"MCowBQYDK2VwAyEAPUAXw+hDiVqStwqnTRt+vJyYLM8uxJaMwM1V8Sr0Zgw=","public_key_digest":"sha256:deb2ded39dc26fce0e6085b6fc34bf6b5941913bbfe2ea614113cff9e004c170","public_key_format":"spki-der-base64","status":"active","usage":"release-status-signing","valid_from":"2026-01-01T00:00:00Z","valid_until":"2028-01-01T00:00:00Z"}],"limitations":["Trust-root authenticity is an external verifier decision and is not established by a release bundle."],"permitted_signing_profiles":[{"id":"private-match-public-release-signing","version":"0.1"}],"schema_version":"0.1","trust_domain_id":"itdo-private-match-assurance-fixture-v0.1","trust_root_digest":"sha256:f4764c935adbadaea8e1ba55f38f7a6962f7022472454b3141e9664c80fc0689","trust_root_revision":1}